{
  "$schema": "http://json-schema.org/draft-07/schema#",
  "$id": "verb.schema.json",
  "title": "Verb",
  "description": "One verb, its conjugation and its sentences: content/verbs/<verb>.json.",
  "type": "object",
  "additionalProperties": false,
  "required": [
    "id",
    "infinitive",
    "group",
    "auxiliary",
    "level",
    "categories",
    "forms",
    "sentences"
  ],
  "properties": {
    "id": {
      "type": "string",
      "pattern": "^v\\.[a-z0-9]+(-[a-z0-9]+)*$"
    },
    "infinitive": { "$ref": "#/definitions/text" },
    "group": { "enum": ["er", "ir", "re", "irr"] },
    "auxiliary": { "enum": ["avoir", "etre"] },
    "pronominal": { "type": "boolean" },
    "h_aspire": {
      "description": "Forms starting with h don't elide what comes before them (je hais). Required when a form starts with h.",
      "type": "boolean"
    },
    "level": { "enum": ["debutant", "intermediaire", "avance"] },
    "rank": {
      "description": "Frequency rank, 1 the most common.",
      "type": "integer",
      "minimum": 1
    },
    "categories": {
      "description": "Verb categories, from content/verb-categories.json.",
      "type": "array",
      "minItems": 1,
      "uniqueItems": true,
      "items": {
        "type": "string",
        "pattern": "^cat\\.[a-z0-9]+(-[a-z0-9]+)*$"
      }
    },
    "forms": {
      "description": "A form per tense and person. Compound tenses give the masculine singular participle (suis allé). Reflexive verbs include the pronoun (me lève).",
      "type": "object",
      "additionalProperties": false,
      "required": ["present", "passe_compose", "imparfait", "futur_simple"],
      "properties": {
        "present": { "$ref": "#/definitions/tenseForms" },
        "passe_compose": { "$ref": "#/definitions/tenseForms" },
        "imparfait": { "$ref": "#/definitions/tenseForms" },
        "futur_simple": { "$ref": "#/definitions/tenseForms" }
      }
    },
    "sentences": {
      "type": "array",
      "minItems": 1,
      "items": { "$ref": "#/definitions/sentence" }
    }
  },
  "definitions": {
    "text": { "type": "string", "pattern": "\\S" },
    "person": { "enum": ["1s", "2s", "3s", "1p", "2p", "3p"] },
    "alternatives": {
      "type": "array",
      "minItems": 1,
      "items": { "$ref": "#/definitions/text" }
    },
    "tenseForms": {
      "type": "object",
      "additionalProperties": false,
      "required": ["1s", "2s", "3s", "1p", "2p", "3p"],
      "properties": {
        "1s": { "$ref": "#/definitions/text" },
        "2s": { "$ref": "#/definitions/text" },
        "3s": { "$ref": "#/definitions/text" },
        "1p": { "$ref": "#/definitions/text" },
        "2p": { "$ref": "#/definitions/text" },
        "3p": { "$ref": "#/definitions/text" },
        "alt": {
          "description": "Other accepted forms, by person (paye beside paie).",
          "type": "object",
          "additionalProperties": false,
          "properties": {
            "1s": { "$ref": "#/definitions/alternatives" },
            "2s": { "$ref": "#/definitions/alternatives" },
            "3s": { "$ref": "#/definitions/alternatives" },
            "1p": { "$ref": "#/definitions/alternatives" },
            "2p": { "$ref": "#/definitions/alternatives" },
            "3p": { "$ref": "#/definitions/alternatives" }
          }
        }
      }
    },
    "sentence": {
      "type": "object",
      "additionalProperties": false,
      "required": ["id", "tense", "person", "text", "answer"],
      "properties": {
        "id": {
          "type": "string",
          "pattern": "^s\\.[a-z0-9]+(-[a-z0-9]+)*(\\.[a-z0-9]+)+$"
        },
        "tense": {
          "enum": ["present", "passe_compose", "imparfait", "futur_simple"]
        },
        "person": { "$ref": "#/definitions/person" },
        "text": {
          "description": "The sentence with ___ once where the verb goes, and every word before it written in full (Je ___, never J’___).",
          "$ref": "#/definitions/text"
        },
        "answer": {
          "description": "Only what fills the blank, with any agreement (sommes allés).",
          "$ref": "#/definitions/text"
        },
        "alternatives": { "$ref": "#/definitions/alternatives" }
      }
    }
  }
}
