{
  "id": "v.faire",
  "infinitive": "faire",
  "group": "irr",
  "auxiliary": "avoir",
  "pronominal": false,
  "level": "debutant",
  "rank": 3,
  "categories": ["cat.verbes-essentiels"],
  "forms": {
    "present": {
      "1s": "fais",
      "2s": "fais",
      "3s": "fait",
      "1p": "faisons",
      "2p": "faites",
      "3p": "font"
    },
    "passe_compose": {
      "1s": "ai fait",
      "2s": "as fait",
      "3s": "a fait",
      "1p": "avons fait",
      "2p": "avez fait",
      "3p": "ont fait"
    },
    "imparfait": {
      "1s": "faisais",
      "2s": "faisais",
      "3s": "faisait",
      "1p": "faisions",
      "2p": "faisiez",
      "3p": "faisaient"
    },
    "futur_simple": {
      "1s": "ferai",
      "2s": "feras",
      "3s": "fera",
      "1p": "ferons",
      "2p": "ferez",
      "3p": "feront"
    }
  },
  "sentences": [
    { "id": "s.faire.pr.1s.01", "tense": "present", "person": "1s",
      "text": "Je ___ du sport le samedi.", "answer": "fais" },
    { "id": "s.faire.pr.2s.01", "tense": "present", "person": "2s",
      "text": "Qu’est-ce que tu ___ ce soir ?", "answer": "fais" },
    { "id": "s.faire.pr.3s.01", "tense": "present", "person": "3s",
      "text": "Il ___ beau aujourd’hui.", "answer": "fait" },
    { "id": "s.faire.pr.1p.01", "tense": "present", "person": "1p",
      "text": "Nous ___ les courses ensemble.", "answer": "faisons" },
    { "id": "s.faire.pr.2p.01", "tense": "present", "person": "2p",
      "text": "Vous ___ quoi dans la vie ?", "answer": "faites" },
    { "id": "s.faire.pr.3p.01", "tense": "present", "person": "3p",
      "text": "Les enfants ___ leurs devoirs.", "answer": "font" },

    { "id": "s.faire.pc.1s.01", "tense": "passe_compose", "person": "1s",
      "text": "Je ___ un gâteau pour ton anniversaire.", "answer": "ai fait" },
    { "id": "s.faire.pc.2s.01", "tense": "passe_compose", "person": "2s",
      "text": "Tu ___ tes valises ?", "answer": "as fait" },
    { "id": "s.faire.pc.3s.01", "tense": "passe_compose", "person": "3s",
      "text": "Elle ___ une erreur dans le calcul.", "answer": "a fait" },
    { "id": "s.faire.pc.1p.01", "tense": "passe_compose", "person": "1p",
      "text": "Nous ___ une longue promenade hier.",
      "answer": "avons fait" },
    { "id": "s.faire.pc.2p.01", "tense": "passe_compose", "person": "2p",
      "text": "Vous ___ bon voyage ?", "answer": "avez fait" },
    { "id": "s.faire.pc.3p.01", "tense": "passe_compose", "person": "3p",
      "text": "Ils ___ beaucoup de bruit cette nuit.", "answer": "ont fait" },

    { "id": "s.faire.im.1s.01", "tense": "imparfait", "person": "1s",
      "text": "Avant, je ___ du piano tous les jours.", "answer": "faisais" },
    { "id": "s.faire.im.2s.01", "tense": "imparfait", "person": "2s",
      "text": "Avant, tu ___ souvent la cuisine.", "answer": "faisais" },
    { "id": "s.faire.im.3s.01", "tense": "imparfait", "person": "3s",
      "text": "Il ___ très froid cet hiver-là.", "answer": "faisait" },
    { "id": "s.faire.im.1p.01", "tense": "imparfait", "person": "1p",
      "text": "Nous ___ du camping chaque été.", "answer": "faisions" },
    { "id": "s.faire.im.2p.01", "tense": "imparfait", "person": "2p",
      "text": "Vous ___ quoi quand je vous ai appelés ?",
      "answer": "faisiez" },
    { "id": "s.faire.im.3p.01", "tense": "imparfait", "person": "3p",
      "text": "Les voisins ___ souvent la fête le samedi.",
      "answer": "faisaient" },

    { "id": "s.faire.fs.1s.01", "tense": "futur_simple", "person": "1s",
      "text": "Je ___ attention, c’est promis.", "answer": "ferai" },
    { "id": "s.faire.fs.2s.01", "tense": "futur_simple", "person": "2s",
      "text": "Tu ___ la vaisselle après le dîner.", "answer": "feras" },
    { "id": "s.faire.fs.3s.01", "tense": "futur_simple", "person": "3s",
      "text": "Il ___ chaud demain.", "answer": "fera" },
    { "id": "s.faire.fs.1p.01", "tense": "futur_simple", "person": "1p",
      "text": "Nous ___ un pique-nique dimanche.", "answer": "ferons" },
    { "id": "s.faire.fs.2p.01", "tense": "futur_simple", "person": "2p",
      "text": "Vous ___ ce travail la semaine prochaine.", "answer": "ferez" },
    { "id": "s.faire.fs.3p.01", "tense": "futur_simple", "person": "3p",
      "text": "Ils ___ des progrès avec le temps.", "answer": "feront" }
  ]
}
