{
  "id": "v.aller",
  "infinitive": "aller",
  "group": "irr",
  "auxiliary": "etre",
  "pronominal": false,
  "level": "debutant",
  "rank": 5,
  "categories": ["cat.verbes-essentiels"],
  "forms": {
    "present": {
      "1s": "vais",
      "2s": "vas",
      "3s": "va",
      "1p": "allons",
      "2p": "allez",
      "3p": "vont"
    },
    "passe_compose": {
      "1s": "suis allé",
      "2s": "es allé",
      "3s": "est allé",
      "1p": "sommes allé",
      "2p": "êtes allé",
      "3p": "sont allé"
    },
    "imparfait": {
      "1s": "allais",
      "2s": "allais",
      "3s": "allait",
      "1p": "allions",
      "2p": "alliez",
      "3p": "allaient"
    },
    "futur_simple": {
      "1s": "irai",
      "2s": "iras",
      "3s": "ira",
      "1p": "irons",
      "2p": "irez",
      "3p": "iront"
    }
  },
  "sentences": [
    { "id": "s.aller.pr.1s.01", "tense": "present", "person": "1s",
      "text": "Je ___ au marché le samedi.", "answer": "vais" },
    { "id": "s.aller.pr.2s.01", "tense": "present", "person": "2s",
      "text": "Tu ___ à l’école à pied ?", "answer": "vas" },
    { "id": "s.aller.pr.3s.01", "tense": "present", "person": "3s",
      "text": "Elle ___ chez le médecin demain matin.", "answer": "va" },
    { "id": "s.aller.pr.1p.01", "tense": "present", "person": "1p",
      "text": "Nous ___ souvent à la plage en été.", "answer": "allons" },
    { "id": "s.aller.pr.2p.01", "tense": "present", "person": "2p",
      "text": "Vous ___ bien ?", "answer": "allez" },
    { "id": "s.aller.pr.3p.01", "tense": "present", "person": "3p",
      "text": "Ils ___ au cinéma ce soir.", "answer": "vont" },

    { "id": "s.aller.pc.1s.01", "tense": "passe_compose", "person": "1s",
      "text": "Hier, je ___ à la boulangerie.", "answer": "suis allé",
      "alternatives": ["suis allée"] },
    { "id": "s.aller.pc.2s.01", "tense": "passe_compose", "person": "2s",
      "text": "Tu ___ à Paris l’année dernière ?", "answer": "es allé",
      "alternatives": ["es allée"] },
    { "id": "s.aller.pc.3s.01", "tense": "passe_compose", "person": "3s",
      "text": "Elle ___ au travail en bus.", "answer": "est allée" },
    { "id": "s.aller.pc.1p.01", "tense": "passe_compose", "person": "1p",
      "text": "Hier, nous ___ au cinéma.", "answer": "sommes allés",
      "alternatives": ["sommes allées"] },
    { "id": "s.aller.pc.2p.01", "tense": "passe_compose", "person": "2p",
      "text": "Mesdames, vous ___ à la réunion ?", "answer": "êtes allées" },
    { "id": "s.aller.pc.3p.01", "tense": "passe_compose", "person": "3p",
      "text": "Mes parents ___ en Italie cet été.", "answer": "sont allés" },

    { "id": "s.aller.im.1s.01", "tense": "imparfait", "person": "1s",
      "text": "Quand j’étais petit, je ___ chez ma grand-mère le dimanche.",
      "answer": "allais" },
    { "id": "s.aller.im.2s.01", "tense": "imparfait", "person": "2s",
      "text": "Avant, tu ___ au travail en voiture.", "answer": "allais" },
    { "id": "s.aller.im.3s.01", "tense": "imparfait", "person": "3s",
      "text": "Il ___ à la piscine tous les mercredis.", "answer": "allait" },
    { "id": "s.aller.im.1p.01", "tense": "imparfait", "person": "1p",
      "text": "Nous ___ souvent au parc quand il faisait beau.",
      "answer": "allions" },
    { "id": "s.aller.im.2p.01", "tense": "imparfait", "person": "2p",
      "text": "Vous ___ à l’école ensemble ?", "answer": "alliez" },
    { "id": "s.aller.im.3p.01", "tense": "imparfait", "person": "3p",
      "text": "Elles ___ au marché chaque semaine.", "answer": "allaient" },

    { "id": "s.aller.fs.1s.01", "tense": "futur_simple", "person": "1s",
      "text": "Demain, je ___ à la banque.", "answer": "irai" },
    { "id": "s.aller.fs.2s.01", "tense": "futur_simple", "person": "2s",
      "text": "Tu ___ voir ce film avec nous ?", "answer": "iras" },
    { "id": "s.aller.fs.3s.01", "tense": "futur_simple", "person": "3s",
      "text": "Elle ___ en vacances en août.", "answer": "ira" },
    { "id": "s.aller.fs.1p.01", "tense": "futur_simple", "person": "1p",
      "text": "Nous ___ à la montagne l’hiver prochain.", "answer": "irons" },
    { "id": "s.aller.fs.2p.01", "tense": "futur_simple", "person": "2p",
      "text": "Vous ___ à la fête samedi ?", "answer": "irez" },
    { "id": "s.aller.fs.3p.01", "tense": "futur_simple", "person": "3p",
      "text": "Ils ___ à Lyon en train.", "answer": "iront" }
  ]
}
